{
  "translator": "on-the-record",
  "version": "1",
  "source": {
    "file": "inputs/quick-checkin.txt",
    "last_line": "L0014"
  },
  "meeting": {
    "title": "not in source",
    "date": "not in source",
    "participants": [
      "Ellie",
      "Marcus"
    ]
  },
  "actions": [],
  "decisions": [],
  "figures": [],
  "questions": [],
  "not_mapped": []
}
